{
  "$schema": "https://json-schema.org/draft/2020-12/schema",
  "title": "SDRF evidence manifest",
  "description": "Provenance the producer of an SDRF hands to the independent reviewer: the sources it used and which value each source supports. It is provenance, not proof. Explanation: skills/sdrf-adversarial-review/references/review-contract.md.",
  "type": "object",
  "required": ["schema_version", "artifact", "dataset", "sources", "claims"],
  "properties": {
    "schema_version": {"const": 1},
    "artifact": {
      "description": "Path of the SDRF this manifest describes.",
      "type": "string",
      "pattern": "\\S"
    },
    "dataset": {
      "description": "Repository accession, e.g. PXD000001.",
      "type": "string",
      "pattern": "\\S"
    },
    "sources": {
      "type": "array",
      "minItems": 1,
      "items": {
        "type": "object",
        "required": ["id", "kind", "location"],
        "properties": {
          "id": {
            "description": "Short name that claims cite in source_ids.",
            "type": "string",
            "pattern": "\\S"
          },
          "kind": {
            "description": "e.g. repository, publication, supplementary, search-output, raw-file.",
            "type": "string",
            "pattern": "\\S"
          },
          "location": {
            "description": "Exact URL, PMCID/DOI or local path.",
            "type": "string",
            "pattern": "\\S"
          }
        }
      }
    },
    "claims": {
      "type": "array",
      "minItems": 1,
      "items": {
        "type": "object",
        "required": ["location", "value", "source_ids", "evidence"],
        "properties": {
          "location": {
            "description": "Column and rows the claim covers, e.g. 'characteristics[organism] rows 1-12'.",
            "type": "string",
            "pattern": "\\S"
          },
          "value": {"type": "string"},
          "source_ids": {
            "description": "Ids from sources[].id that support the value.",
            "type": "array",
            "minItems": 1,
            "items": {"type": "string", "pattern": "\\S"}
          },
          "evidence": {
            "description": "What the cited sources say, at the granularity of the value.",
            "type": "string",
            "pattern": "\\S"
          }
        }
      }
    },
    "limitations": {
      "description": "Evidence that was unavailable or weaker than the values need.",
      "type": "array",
      "items": {"type": "string", "pattern": "\\S"}
    }
  }
}
